{
  "$schema": "https://json-schema.org/draft/2020-12/schema",
  "$id": "https://tarui.dev/schemas/app.v1.json",
  "title": "Tarui Application Manifest",
  "description": "Build-time manifest consumed by the Tarui CLI (tarui dev / tarui build). Runtime host configuration stays in appsettings.json; this file only drives frontend orchestration, output locations, bundle targets and product identity.",
  "type": "object",
  "additionalProperties": false,
  "required": ["product", "build", "bundle"],
  "properties": {
    "$schema": { "type": "string" },
    "product": {
      "type": "object",
      "additionalProperties": false,
      "required": ["name", "version", "identifier"],
      "properties": {
        "name": { "type": "string", "minLength": 1 },
        "version": { "type": "string", "pattern": "^\\d+\\.\\d+\\.\\d+" },
        "identifier": { "type": "string", "minLength": 1 }
      }
    },
    "build": {
      "type": "object",
      "additionalProperties": false,
      "required": ["frontendDist"],
      "properties": {
        "frontend": { "type": "string", "description": "Frontend project root, relative to this manifest. Used as the working directory for beforeDevCommand / beforeBuildCommand. Defaults to the manifest directory." },
        "beforeDevCommand": { "type": "string", "description": "Command that starts the frontend dev server, e.g. 'pnpm dev'." },
        "devUrl": { "type": "string", "format": "uri", "description": "HTTP(S) URL the dev server listens on. Injected into the host via TARUI_WEB_MODE=http and TARUI_WEB_URL." },
        "beforeBuildCommand": { "type": "string", "description": "Command that builds the frontend, e.g. 'pnpm build'." },
        "frontendDist": { "type": "string", "description": "Directory containing the built frontend (must contain index.html after beforeBuildCommand). Injected via TARUI_WEB_ROOT in scheme mode." },
        "desktopProject": { "type": "string", "description": "Desktop .csproj to run/publish. Optional: auto-detected when the app contains exactly one .csproj." }
      }
    },
    "bundle": {
      "type": "object",
      "additionalProperties": false,
      "required": ["targets"],
      "properties": {
        "targets": {
          "type": "array",
          "minItems": 1,
          "items": { "type": "string", "enum": ["zip", "msix", "app-bundle"] }
        },
        "icon": { "type": "string" },
        "shortDescription": { "type": "string" },
        "fileAssociations": {
          "type": "array",
          "description": "Document types this app claims (Tauri-aligned). Injected into the MSIX AppxManifest (windows.fileTypeAssociation), Info.plist CFBundleDocumentTypes, and registered per-user by the runtime on Windows for portable builds.",
          "items": {
            "type": "object",
            "additionalProperties": false,
            "required": ["ext", "name"],
            "properties": {
              "ext": {
                "type": "string",
                "pattern": "^\\.[A-Za-z0-9][A-Za-z0-9._-]*$",
                "maxLength": 64,
                "description": "File extension including the leading dot, e.g. '.tdoc'."
              },
              "name": {
                "type": "string",
                "minLength": 1,
                "description": "Association display name (ProgID display name / CFBundleTypeName)."
              },
              "description": {
                "type": "string",
                "maxLength": 512
              },
              "mimeType": {
                "type": "string",
                "pattern": "^[a-zA-Z0-9][a-zA-Z0-9!#$&^_.+-]*/[a-zA-Z0-9][a-zA-Z0-9!#$&^_.+-]*$",
                "description": "Optional type/subtype MIME type emitted as the MSIX FileType ContentType."
              },
              "role": {
                "type": "string",
                "enum": ["Editor", "Viewer", "Shell", "None"],
                "description": "macOS CFBundleTypeRole. Defaults to Editor."
              }
            }
          }
        },
        "macOS": {
          "type": "object",
          "description": "macOS application bundle options. Consumed by tarui build --bundle app-bundle; ignored otherwise. Schemes are injected into Info.plist CFBundleURLTypes so the OS hands deep-link activations to this app.",
          "additionalProperties": false,
          "properties": {
            "bundleId": {
              "type": "string",
              "description": "Reverse-DNS CFBundleIdentifier. Defaults to product.identifier when omitted."
            },
            "executableName": {
              "type": "string",
              "description": "CFBundleExecutable inside Contents/MacOS. Defaults to the product name when omitted."
            },
            "minimumSystemVersion": {
              "type": "string",
              "pattern": "^\\d+(\\.\\d+){0,2}$",
              "description": "LSMinimumSystemVersion. Defaults to a RID-derived minimum (11.0 for osx-arm64, 10.15 for osx-x64)."
            },
            "schemes": {
              "type": "array",
              "description": "Custom URL schemes registered via CFBundleURLTypes. Token grammar mirrors Tarui:Application:DeepLinkSchemes (RFC 3986 scheme: ALPHA *( ALPHA / DIGIT / + / - / . )).",
              "items": {
                "type": "string",
                "pattern": "^[A-Za-z][A-Za-z0-9+.\\-]*$",
                "minLength": 1,
                "maxLength": 64
              },
              "uniqueItems": true
            }
          }
        }
      }
    },
    "app": {
      "type": "object",
      "additionalProperties": false,
      "properties": {
        "capabilities": {
          "type": "array",
          "items": { "type": "string", "minLength": 1 },
          "description": "Capability identifiers referenced from capabilities/<id>.json."
        }
      }
    }
  }
}
