{
  "$schema": "https://tarui.dev/schemas/app.v1.json",
  "product": {
    "name": "demo",
    "version": "0.5.4",
    "identifier": "dev.demo"
  },
  "build": {
    "frontend": "web",
    "beforeDevCommand": "pnpm dev",
    "devUrl": "http://localhost:5173",
    "beforeBuildCommand": "pnpm build",
    "frontendDist": "web/dist",
    "desktopProject": "Demo.Desktop/Demo.Desktop.csproj"
  },
  "bundle": {
    "targets": [
      "zip"
    ],
    "shortDescription": "A Tarui desktop application",
    "fileAssociations": [
      {
        "ext": ".tdoc",
        "name": "Tarui Demo Document",
        "description": "Demo document owned by the Tarui demo app",
        "mimeType": "application/x-tdoc",
        "role": "Editor"
      }
    ]
  },
  "app": {
    "capabilities": [
      "main",
      "editor"
    ]
  }
}